{
  "version": "1.0",
  "project_id": "foxconn-core-values-course",
  "content_form": "course_form",
  "title": "鴻海六大核心價值實戰情境引導課程",
  "target_duration_seconds": 2400.0,
  "course_promise": {
    "learner": "鴻海科技集團全球新進員工、專案主管與協同團隊成員",
    "capability": "在面臨交期排程、良率瓶頸、跨部門權責衝突及客戶兩難困境時，能準確識別並踐行誠信、勤奮、敏捷、分享、合作、共榮六大行為準則",
    "use_context": "跨功能團隊（CFT）專案溝通、產線異常即時處置、供應鏈與客戶商務合作談判",
    "success_evidence": "在職場情境兩難案例測驗中做出符合集團價值導向之決策，並能在日常考核中展現可驗證的行為改變"
  },
  "audience": [
    "全球新進員工培訓（集團入職引導）",
    "基層與中階專案管理主管（CFT核心成員）",
    "跨廠區跨文化協同作業團隊"
  ],
  "entry_requirements": [
    "具備基本製造業或科技業專案運作概念",
    "熟悉日常辦公溝通與會議流程"
  ],
  "objectives": [
    {
      "id": "obj-01",
      "actor": "學員",
      "observable_verb": "辨析並坦誠通報",
      "object": "專案交期與數據瑕疵中的真實狀況，不隱瞞、不粉飾",
      "conditions": "在面臨進度延誤或良率波動的情境下",
      "success_evidence": "能列出誠信通報的具體應對步驟與補救方案",
      "source_refs": [
        "src-01",
        "src-04"
      ]
    },
    {
      "id": "obj-02",
      "actor": "學員",
      "observable_verb": "重構並聚焦",
      "object": "工作中具高價值的關鍵產出，消除無效加班與形式主義作業",
      "conditions": "在日常排程管理與任務分派中",
      "success_evidence": "提出一項精益改善流程提案，量化工時節省與價值提升",
      "source_refs": [
        "src-01",
        "src-04"
      ]
    },
    {
      "id": "obj-03",
      "actor": "學員",
      "observable_verb": "採用小步快跑策略",
      "object": "基於客觀數據快速試錯並動態微調執行計畫",
      "conditions": "在客戶需求變更或產線突發異常時",
      "success_evidence": "能在24小時內啟動PDCA循環並產出第一版修正對策",
      "source_refs": [
        "src-01",
        "src-03"
      ]
    },
    {
      "id": "obj-04",
      "actor": "學員",
      "observable_verb": "建立並貢獻",
      "object": "跨部門可複用的技術文檔、模板與經驗教訓資產，打破資訊孤島",
      "conditions": "在專案結案或技術突破後",
      "success_evidence": "在知識共享平台提交一份標準化覆盤文檔",
      "source_refs": [
        "src-01",
        "src-03"
      ]
    },
    {
      "id": "obj-05",
      "actor": "學員",
      "observable_verb": "跨界溝通並共擔責任",
      "object": "跨功能團隊（CFT）的共同目標，達成協同共識",
      "conditions": "在跨部門權責重疊或資源爭奪出現時",
      "success_evidence": "主動發起對齊會議並簽署跨部門責任確認書",
      "source_refs": [
        "src-01",
        "src-05"
      ]
    },
    {
      "id": "obj-06",
      "actor": "學員",
      "observable_verb": "落實生態共贏原則",
      "object": "與客戶、供應商及在地夥伴形成長期互利的合作機制",
      "conditions": "在外部商務談判、供應鏈稽核或在地化運營中",
      "success_evidence": "決策符合BOL商業模式與EPS+ESG雙軌方程式的要求",
      "source_refs": [
        "src-01",
        "src-02",
        "src-03"
      ]
    }
  ],
  "modules": [
    {
      "id": "mod-00",
      "title": "導論：開啟下一個50年的文化基石",
      "intermediate_capability": "理解鴻海從製造代工邁向3+3科技服務轉型背景下，六大核心價值的戰略定位",
      "target_duration_seconds": 240.0,
      "objective_ids": [
        "obj-01",
        "obj-06"
      ],
      "recap_intent": "總結六大核心價值分為內在特質（誠信、勤奮、敏捷）與外在實踐（分享、合作、共榮），是邁向下一個50年的共同語言",
      "lessons": [
        {
          "id": "les-00",
          "title": "文化啟航：五十年淬鍊與新世代挑戰",
          "target_duration_seconds": 240.0,
          "objective_ids": [
            "obj-01",
            "obj-06"
          ],
          "prerequisite_lesson_ids": [],
          "prerequisite_objective_ids": [],
          "expected_outcome": "學員能清楚陳述六大核心價值的雙層架構及其與EPS+ESG的關聯",
          "source_refs": [
            "src-01",
            "src-02"
          ],
          "teaching_beats": [
            {
              "kind": "hook",
              "intent": "從鴻海50週年全球布局開場，直擊現代企業面臨的複雜挑戰",
              "objective_ids": [
                "obj-06"
              ]
            },
            {
              "kind": "explanation",
              "intent": "解析六大核心價值架構：內在特質 vs 對外實踐",
              "objective_ids": [
                "obj-01",
                "obj-06"
              ]
            },
            {
              "kind": "recap",
              "intent": "帶出課程全景地圖，預告後續六大實戰情境劇",
              "objective_ids": [
                "obj-01"
              ]
            }
          ],
          "glossary_ids": [
            "glo-01",
            "glo-07",
            "glo-08"
          ],
          "notation_ids": [
            "not-01"
          ],
          "export_required": true
        }
      ]
    },
    {
      "id": "mod-01",
      "title": "第一講：誠信 — 守住底線的專業基石",
      "intermediate_capability": "在面臨短期業績與真實品質數據衝突時，堅持客觀誠實與合規底線",
      "target_duration_seconds": 360.0,
      "objective_ids": [
        "obj-01"
      ],
      "recap_intent": "誠信是信任資產的最高效建立方式，隱瞞的代價永遠高於坦誠面對",
      "lessons": [
        {
          "id": "les-01",
          "title": "情境劇實戰：交期落後兩週，你敢據實通報嗎？",
          "target_duration_seconds": 360.0,
          "objective_ids": [
            "obj-01"
          ],
          "prerequisite_lesson_ids": [
            "les-00"
          ],
          "prerequisite_objective_ids": [],
          "expected_outcome": "學員掌握誠信通報的四步溝通模型（數據、原因、對策、預估）",
          "source_refs": [
            "src-01",
            "src-04"
          ],
          "teaching_beats": [
            {
              "kind": "hook",
              "intent": "辦公室情境衝突：專案經理發現測試數據異常，面臨客訴與交期的天人交戰",
              "objective_ids": [
                "obj-01"
              ]
            },
            {
              "kind": "worked_example",
              "intent": "對比示範：粉飾數據導致全批退貨 vs 坦誠通報共同尋求備案",
              "objective_ids": [
                "obj-01"
              ]
            },
            {
              "kind": "recap",
              "intent": "提煉誠信核心指標：言行一致、守信重諾、依法合規",
              "objective_ids": [
                "obj-01"
              ]
            }
          ],
          "glossary_ids": [
            "glo-01"
          ],
          "notation_ids": [
            "not-01"
          ],
          "export_required": true
        }
      ]
    },
    {
      "id": "mod-02",
      "title": "第二講：勤奮 — 價值與高效的精益追求",
      "intermediate_capability": "破除以工時長短衡量貢獻的迷思，轉向以價值創造與流程高效為核心的精益工作法",
      "target_duration_seconds": 360.0,
      "objective_ids": [
        "obj-02"
      ],
      "recap_intent": "勤奮不是疲勞戰術，而是在高價值目標上精益求精、持續消除浪費",
      "lessons": [
        {
          "id": "les-02",
          "title": "情境劇實戰：加班到深夜就是好員工？重新定義價值創造",
          "target_duration_seconds": 360.0,
          "objective_ids": [
            "obj-02"
          ],
          "prerequisite_lesson_ids": [
            "les-01"
          ],
          "prerequisite_objective_ids": [
            "obj-01"
          ],
          "expected_outcome": "學員能運用價值矩陣篩選工作任務，剔除非必要冗餘作業",
          "source_refs": [
            "src-01",
            "src-04"
          ],
          "teaching_beats": [
            {
              "kind": "hook",
              "intent": "辦公室對比：每天忙於格式修改的疲憊同仁 vs 運用自動化工具高效交付的團隊",
              "objective_ids": [
                "obj-02"
              ]
            },
            {
              "kind": "demonstration",
              "intent": "展示任務價值評估四象限：高價值核心 vs 低價值冗餘",
              "objective_ids": [
                "obj-02"
              ]
            },
            {
              "kind": "recap",
              "intent": "總結勤奮本質：以高效達成卓越品質，不懈追求進步",
              "objective_ids": [
                "obj-02"
              ]
            }
          ],
          "glossary_ids": [
            "glo-02"
          ],
          "notation_ids": [
            "not-02"
          ],
          "export_required": true
        }
      ]
    },
    {
      "id": "mod-03",
      "title": "第三講：敏捷 — 科學決策與小步快跑",
      "intermediate_capability": "在快速變化的外部環境與客製化需求中，以科學驗證代替主觀臆測，快速迭代",
      "target_duration_seconds": 360.0,
      "objective_ids": [
        "obj-03"
      ],
      "recap_intent": "敏捷不是打亂節奏，而是用最小可行步驟（MVP）快速驗證對策並動態調整",
      "lessons": [
        {
          "id": "les-03",
          "title": "情境劇實戰：突發工程變更，如何在SOP下小步快跑？",
          "target_duration_seconds": 360.0,
          "objective_ids": [
            "obj-03"
          ],
          "prerequisite_lesson_ids": [
            "les-02"
          ],
          "prerequisite_objective_ids": [
            "obj-02"
          ],
          "expected_outcome": "學員掌握敏捷試錯的科學閉環流程（假設、驗證、度量、學習）",
          "source_refs": [
            "src-01",
            "src-03"
          ],
          "teaching_beats": [
            {
              "kind": "hook",
              "intent": "會議室白板前的激烈爭辯：傳統按部就班修改需一個月，客戶要求三天內提供樣品",
              "objective_ids": [
                "obj-03"
              ]
            },
            {
              "kind": "worked_example",
              "intent": "拆解敏捷應對策略：分模組小批次驗證，鎖定關鍵參數快速過關",
              "objective_ids": [
                "obj-03"
              ]
            },
            {
              "kind": "recap",
              "intent": "提煉敏捷心法：預見問題、洞察機會、科學決策、保持彈性",
              "objective_ids": [
                "obj-03"
              ]
            }
          ],
          "glossary_ids": [
            "glo-03"
          ],
          "notation_ids": [
            "not-03"
          ],
          "export_required": true
        }
      ]
    },
    {
      "id": "mod-04",
      "title": "第四講：分享 — 利他思維與知識流動",
      "intermediate_capability": "建立開放包容心態，主動將個人或團隊優秀經驗平台化、工具化，賦能組織",
      "target_duration_seconds": 360.0,
      "objective_ids": [
        "obj-04"
      ],
      "recap_intent": "分享不是犧牲個人競爭力，而是透過利他思維在組織內建立可倍增的影響力",
      "lessons": [
        {
          "id": "les-04",
          "title": "情境劇實戰：我獨門研發的排程密技，為什麼要教別人？",
          "target_duration_seconds": 360.0,
          "objective_ids": [
            "obj-04"
          ],
          "prerequisite_lesson_ids": [
            "les-03"
          ],
          "prerequisite_objective_ids": [
            "obj-03"
          ],
          "expected_outcome": "學員能將專有工作技巧轉化為團隊共用的標準作業指引或模板",
          "source_refs": [
            "src-01",
            "src-03"
          ],
          "teaching_beats": [
            {
              "kind": "hook",
              "intent": "咖啡廳交談：資深員工的私心顧慮 vs 知識分享帶來的跨廠區技術認可",
              "objective_ids": [
                "obj-04"
              ]
            },
            {
              "kind": "model",
              "intent": "展示組織知識流動效益：個人密技變成集團標準工具，創造全域價值",
              "objective_ids": [
                "obj-04"
              ]